{
  "version": 1,
  "context": "sales",
  "api": "OpenAPI_3.0.1",
  "field": [
    {
      "path": "/riskmanagement/vote",
      "operation": "post",
      "input": [
        {
          "name": "contract_number",
          "in": "query",
          "required": true,
          "type": "string"
        },
        {
          "name": "vote_result",
          "in": "query",
          "required": true,
          "type": "string"
        }
      ],
      "body": {},
      "output": [
        {
          "*/*": {
            "type": "string",
            "expected_code": "200"
          }
        }
      ],
      "operation_id": "voteContract"
    },
    {
      "path": "/riskmanagement/rating",
      "operation": "get",
      "input": [
        {
          "name": "contract_number",
          "in": "query",
          "required": true,
          "type": "string"
        }
      ],
      "body": {},
      "output": [
        {
          "*/*": {
            "type": "string",
            "expected_code": "200"
          }
        }
      ],
      "operation_id": "showCreditRating"
    },
    {
      "path": "/riskmanagement/contract",
      "operation": "get",
      "input": [
        {
          "name": "number",
          "in": "query",
          "required": true,
          "type": "string"
        }
      ],
      "body": {},
      "output": [
        {
          "*/*": {
            "type": "string",
            "expected_code": "200"
          }
        }
      ],
      "operation_id": "showContract"
    },
    {
      "path": "/riskmanagement/rate_contract",
      "operation": "post",
      "input": [
        {
          "name": "contract_number",
          "in": "query",
          "required": true,
          "type": "string"
        },
        {
          "name": "creditRating",
          "in": "query",
          "required": true,
          "type": "integer"
        }
      ],
      "body": {},
      "output": [
        {
          "*/*": {
            "type": "string",
            "expected_code": "200"
          }
        }
      ],
      "operation_id": "enterCreditRating"
    },
    {
      "path": "/sales/fillout_contract",
      "operation": "post",
      "input": [
        {
          "name": "contractNumber",
          "in": "query",
          "required": true,
          "type": "string"
        },
        {
          "name": "lessee",
          "in": "query",
          "required": true,
          "type": "string"
        },
        {
          "name": "car",
          "in": "query",
          "required": true,
          "type": "string"
        },
        {
          "name": "price_amount",
          "in": "query",
          "required": true,
          "type": "integer"
        },
        {
          "name": "price_currency",
          "in": "query",
          "required": true,
          "type": "string"
        }
      ],
      "body": {},
      "output": [
        {
          "*/*": {
            "type": "string",
            "expected_code": "200"
          }
        }
      ],
      "operation_id": "filloutContract"
    },
    {
      "path": "/sales/sign_contract",
      "operation": "post",
      "input": [
        {
          "name": "contractNumber",
          "in": "query",
          "required": true,
          "type": "string"
        }
      ],
      "body": {},
      "output": [
        {
          "*/*": {
            "type": "string",
            "expected_code": "200"
          }
        }
      ],
      "operation_id": "signContract"
    },
    {
      "path": "/sales/view_contract",
      "operation": "get",
      "input": [
        {
          "name": "contractNumber",
          "in": "query",
          "required": false,
          "type": "string"
        }
      ],
      "body": {},
      "output": [
        {
          "*/*": {
            "type": "string",
            "expected_code": "200"
          }
        }
      ],
      "operation_id": "viewContract"
    },
    {
      "path": "/riskmanagement/contracts",
      "operation": "get",
      "input": [],
      "body": {},
      "output": [
        {
          "*/*": {
            "type": "string",
            "expected_code": "200"
          }
        }
      ],
      "operation_id": "listContracts"
    }
  ],
  "server_info": [
    {
      "host": "http://127.0.0.1:8080",
      "environment": "Generated server url"
    }
  ],
  "data_schemas": {}
}